{
  "id": "a1b8f204-3e6f-5945-a743-43e82c33e595",
  "author": null,
  "reference": "Te Papa Collections Online: Ua (staff or club), object 180647 — https://collections.tepapa.govt.nz/object/180647",
  "language": "en",
  "claims": [
    {
      "id": "f3914957-34ed-41e9-8ee2-57f4d0dddd64-name",
      "objectId": "f3914957-34ed-41e9-8ee2-57f4d0dddd64",
      "predicate": "has_name",
      "value": "Ua (staff or club)"
    }
  ],
  "images": []
}
