{
  "id": "f6d18f15-bacc-4ee9-ad2a-1bfc60829322",
  "author": "Wikipedia contributors",
  "reference": "https://en.wikipedia.org/wiki/Rongorongo_text_C",
  "language": "en",
  "claims": [
    {
      "id": "7c77ba64-b866-49ce-b702-c9963609fb12",
      "objectId": "588adff0-0fe0-4ed5-9fbf-1f95c3211c7a",
      "predicate": "has_name",
      "value": "Text C"
    },
    {
      "id": "fe0cd6e8-b40a-48b5-9b64-de3634a88707",
      "objectId": "588adff0-0fe0-4ed5-9fbf-1f95c3211c7a",
      "predicate": "has_name",
      "value": "Mamari"
    }
  ],
  "images": []
}
