{
  "id": "619934a3-b259-40fc-a7ef-9fb746503a05",
  "author": null,
  "reference": "Arte en la cultura rapanui, supplied original PDF; museum-object table, pages 15-18; compiler attribution unverified",
  "language": "es",
  "claims": [
    {
      "id": "b2452727-0168-4626-9a64-5765d0be6c8f",
      "objectId": "03e36844-7240-4318-abcb-2419eed4e3a5",
      "predicate": "classified_as",
      "value": "Kava kava de doble cabeza"
    },
    {
      "id": "8a2452df-ef75-4772-98f3-830b97fdc0ef",
      "objectId": "0ad35cd6-b197-4f6b-bfe7-7a7c38ec9029",
      "predicate": "classified_as",
      "value": "Moai de piedra con sombrero"
    },
    {
      "id": "a4f36683-bef9-4336-a6f4-0f1e97c0e1c1",
      "objectId": "2c84d7bd-edcd-4035-b3e8-db968f343414",
      "predicate": "classified_as",
      "value": "Figura humana con boca circular"
    },
    {
      "id": "8113ead4-e50b-4838-845f-59bafa5169c4",
      "objectId": "3cad86a5-9e69-435f-a5d5-a8ff1b736674",
      "predicate": "classified_as",
      "value": "Ao pintado"
    },
    {
      "id": "35840dbf-bddf-4208-b6fb-ba22783d8e4a",
      "objectId": "a3fd565a-c691-413d-9944-7f78fbe58ae2",
      "predicate": "classified_as",
      "value": "Rei miro de gallo"
    },
    {
      "id": "b0420b9a-c7f5-4cf2-a533-9937db513b9c",
      "objectId": "bc103cff-9ee0-4233-bb5d-984dcb109637",
      "predicate": "classified_as",
      "value": "Rei miro con caras humanas y figura incise al centro"
    },
    {
      "id": "33bd8a81-4844-4c96-8c43-d342e98fdc69",
      "objectId": "cdf42f48-1371-4e4b-88b3-fd33158e3cf9",
      "predicate": "classified_as",
      "value": "Tangata Manu con signos rongo rongo"
    },
    {
      "id": "98a83dd1-e1c4-4eb3-ab00-a1f84df515f3",
      "objectId": "d020b17d-3aa1-4df5-aeda-b61d220e3f88",
      "predicate": "classified_as",
      "value": "Piedra almohada con petroglifos (ngaru’a)"
    },
    {
      "id": "ba4ac2fe-59ab-450b-9c3b-41330ce13ea1",
      "objectId": "f2532418-8f48-4e66-a087-d7b345b0f72d",
      "predicate": "classified_as",
      "value": "Rei miro de concha"
    },
    {
      "id": "71dcd615-cf80-4564-9e4f-6367f287d424",
      "objectId": "f69dc677-465b-41d3-9abe-62aefb1900e2",
      "predicate": "classified_as",
      "value": "Tahonga simple con incrustaciones"
    }
  ],
  "images": []
}
