{
  "id": "3b795721-162d-53d7-a237-f20d05a0ba26",
  "author": null,
  "reference": "Arte en la cultura rapanui — original document supplied by Jo; compiler attribution unverified",
  "language": "es",
  "claims": [
    {
      "id": "41a6aec8-37e1-4853-aae9-cb2b8bafdfaf-name",
      "objectId": "41a6aec8-37e1-4853-aae9-cb2b8bafdfaf",
      "predicate": "has_name",
      "value": "Hoa Haka Nana Ia"
    }
  ],
  "images": []
}
