{
  "id": "68c6e53b-292c-4320-bbb0-76cbdb2db846",
  "author": "British Museum",
  "reference": "https://www.britishmuseum.org/collection/object/E_Oc-2595",
  "language": "en",
  "claims": [
    {
      "id": "4d8d6625-9136-48f3-b783-7286a601e2fa",
      "objectId": "0ee63e63-d7b8-4287-b373-54ca77d0bd15",
      "predicate": "catalogue_number",
      "value": "british-museum: Oc,+.2595"
    },
    {
      "id": "e13b6078-291e-4dea-af07-6b21668309f6",
      "objectId": "0ee63e63-d7b8-4287-b373-54ca77d0bd15",
      "predicate": "held_by",
      "value": "British Museum"
    },
    {
      "id": "e2f51df2-0c05-4c62-85fb-0cacf576c514",
      "objectId": "0ee63e63-d7b8-4287-b373-54ca77d0bd15",
      "predicate": "has_name",
      "value": "figure ('moai kavakava')"
    }
  ],
  "images": []
}
