{
  "id": "beb63880-5ad6-49ec-8d1d-37ce0da1bb43",
  "author": null,
  "reference": "Arte en la cultura rapanui, supplied original PDF, page 15; compiler attribution unverified",
  "language": "es",
  "claims": [
    {
      "id": "6a2fe440-abd5-4518-9c6d-96e49eb66597",
      "objectId": "9060635b-5c72-4030-a6a8-1e1740a57fde",
      "predicate": "has_name",
      "value": "Aroukou Kurenga"
    }
  ],
  "images": []
}
