{
  "id": "e9a5a8ed-0ae0-432a-938f-daf2f08bd84a",
  "author": null,
  "reference": "Musée du quai Branly – Jacques Chirac, “Treasures of Rapa Nui (Easter Island)”, Aruku Kureŋa section; accessed 23 September 2026 — https://www.quaibranly.fr/en/collections/living-collections/news/new-display-cases/tresors-de-rapa-nui-lile-de-paques",
  "language": "en",
  "claims": [
    {
      "id": "0848f31f-6074-4814-a4a5-304ae2a1fe18",
      "objectId": "9060635b-5c72-4030-a6a8-1e1740a57fde",
      "predicate": "described_as",
      "value": "asymmetrically shaped and contains almost 1,300 glyphs"
    },
    {
      "id": "42c46593-e25e-45a6-a163-3031c163c783",
      "objectId": "9060635b-5c72-4030-a6a8-1e1740a57fde",
      "predicate": "has_name",
      "value": "Aruku Kureŋa"
    },
    {
      "id": "464c962a-7b1f-4432-bdac-68b6edcfc0c1",
      "objectId": "9060635b-5c72-4030-a6a8-1e1740a57fde",
      "predicate": "classified_as",
      "value": "kohau roŋoroŋo"
    },
    {
      "id": "bd08307c-b156-415c-b4e0-40d8583ea54c",
      "objectId": "9060635b-5c72-4030-a6a8-1e1740a57fde",
      "predicate": "made_of",
      "value": "mako'i wood (Thespesia populnea)"
    }
  ],
  "images": []
}
