{
  "id": "545a3ac6-439d-4172-aa9d-bb437af0dbd9",
  "author": null,
  "reference": "https://www.beweb.chiesacattolica.it/istituticulturali/istituto/3557",
  "language": "it",
  "claims": [
    {
      "id": "f6e5b69b-f23e-49c8-977f-3cef7eab05af",
      "objectId": "588adff0-0fe0-4ed5-9fbf-1f95c3211c7a",
      "predicate": "catalogue_number",
      "value": "sscc-catalogue: P 003"
    }
  ],
  "images": []
}
