{
  "id": "2399cd84-07f7-450e-b97d-407096e5b5a6",
  "author": "Kunstkamera",
  "reference": "https://collection.kunstkamera.ru/en/entity/OBJECT/267042",
  "language": "en",
  "claims": [
    {
      "id": "6d565776-6eac-4e9c-9757-2d77a0d9bb12",
      "objectId": "e81ffe0f-d12c-458b-a334-18c57a48c438",
      "predicate": "held_by",
      "value": "Kunstkamera"
    },
    {
      "id": "d7829885-2d48-42b9-9f2b-52d46a904d51",
      "objectId": "e81ffe0f-d12c-458b-a334-18c57a48c438",
      "predicate": "catalogue_number",
      "value": "kunstkamera: МАЭ № 736-205"
    },
    {
      "id": "dc5208a4-9101-461b-b07e-33ff55cb54dd",
      "objectId": "e81ffe0f-d12c-458b-a334-18c57a48c438",
      "predicate": "located_at",
      "value": "Saint Petersburg"
    }
  ],
  "images": []
}
