{
  "id": "61f7f90c-2957-4bcc-8fb6-8163db1ed0dc",
  "author": "British Museum",
  "reference": "https://www.britishmuseum.org/collection/object/E_Af1898-0115-30",
  "language": "en",
  "claims": [
    {
      "id": "7acb632e-3a3b-4b20-8a73-d918950bf33c",
      "objectId": "ef2fd3c5-7715-48f5-9e52-bfc0e4505ddb",
      "predicate": "has_name",
      "value": "Plaque depicting an Oba with mudfish legs and two leopards"
    },
    {
      "id": "8723a9d2-3f2e-4c34-90f1-909303c57602",
      "objectId": "ef2fd3c5-7715-48f5-9e52-bfc0e4505ddb",
      "predicate": "catalogue_number",
      "value": "british-museum: Af1898,0115.30"
    },
    {
      "id": "e2bd8339-a84d-41b2-a31e-7fe8e58e3b0f",
      "objectId": "ef2fd3c5-7715-48f5-9e52-bfc0e4505ddb",
      "predicate": "made_at",
      "value": "Benin City"
    },
    {
      "id": "ea01a833-3ed9-4c26-b32a-8abfca9eff88",
      "objectId": "ef2fd3c5-7715-48f5-9e52-bfc0e4505ddb",
      "predicate": "held_by",
      "value": "British Museum"
    }
  ],
  "images": []
}
