{
  "id": "bc3cde94-bdd0-406b-bfe0-8b19a0e74aa4",
  "author": "Museum of New Zealand Te Papa Tongarewa",
  "reference": "https://collections.tepapa.govt.nz/object/OL000342",
  "language": "en",
  "claims": [
    {
      "id": "13392755-1aa0-48e9-adac-3b1314f27f85",
      "objectId": "a1a3b544-a63a-4346-9e6c-f97dd31a70d8",
      "predicate": "catalogue_number",
      "value": "te-papa-inventory: OL000342"
    },
    {
      "id": "26abc563-3aff-4253-9e31-4c5eefc42b2e",
      "objectId": "a1a3b544-a63a-4346-9e6c-f97dd31a70d8",
      "predicate": "has_name",
      "value": "moai kavakava"
    },
    {
      "id": "8744f71d-e22b-4dae-a249-6309fe2b19ce",
      "objectId": "a1a3b544-a63a-4346-9e6c-f97dd31a70d8",
      "predicate": "located_at",
      "value": "Wellington"
    },
    {
      "id": "9414ac1a-8f9a-473b-8f67-41d1addc779e",
      "objectId": "a1a3b544-a63a-4346-9e6c-f97dd31a70d8",
      "predicate": "held_by",
      "value": "Museum of New Zealand Te Papa Tongarewa"
    }
  ],
  "images": []
}
