{
  "id": "7160b42c-6e58-5c45-a226-73c86907a5b2",
  "author": null,
  "reference": "Te Papa Collections Online: Ao (Dance paddle), object 180901 — https://collections.tepapa.govt.nz/object/180901",
  "language": "en",
  "claims": [
    {
      "id": "6c2c0808-a209-4767-b463-270db9f8d285-name",
      "objectId": "6c2c0808-a209-4767-b463-270db9f8d285",
      "predicate": "has_name",
      "value": "Ao (Dance paddle)"
    }
  ],
  "images": []
}
